[
  {
    "creator_id": "@miam.usman",
    "metadata": {
      "primary_platform": "instagram",
      "follower_count": 134431,
      "main_category": "lifestyle"
    },
    "visual_persona_deep": {
      "beauty_archetype": {
        "pure_innocent": 0.12,
        "moody_cinematic": 0.28,
        "chic_cold": 0.18,
        "sultry_alluring": 0.22,
        "lovely_juicy": 0.15,
        "quirky_individualistic": 0.08,
        "elegant_classic": 0.42,
        "royal_noble": 0.38,
        "hip_crush": 0.12,
        "androgynous_neutral": 0.05,
        "healthy_vitality": 0.32,
        "intellectual_calm": 0.48,
        "vintage_analog": 0.15,
        "cyber_virtual_perfect": 0.05
      },
      "facial_feature_details": {
        "eye_vibe": "dreamy",
        "smile_type": "gentle",
        "face_shape_index": "oval_smooth",
        "skin_texture_spec": {
          "glass_skin_level": 0.35,
          "velvet_matte_level": 0.55,
          "natural_texture_index": 0.25
        }
      },
      "color_harmony_vector": {
        "seasonal_type": "autumn_warm",
        "dominant_tone": "earthy",
        "contrast_preference": 0.45
      }
    },
    "brand_fit_logic": {
      "soju_affinity_matrix": {
        "chamisul_clean_index": 0.08,
        "chumchurum_soft_index": 0.12,
        "saero_zero_hip_index": 0.18,
        "jinro_retro_index": 0.1,
        "premium_single_malt_index": 0.32
      },
      "kbeauty_role_suitability": [
        "luxury_ambassador",
        "skincare_model"
      ]
    },
    "temporal_evolution_compatibility": {
      "era_1924_1950_classic": 0.05,
      "era_1960_1980_industrial": 0.15,
      "era_1990_2010_digital_y2k": 0.12,
      "era_2020_2026_future_meta": 0.35
    },
    "risk_management": {
      "brand_safety_score": 0.78,
      "competitor_overlap_index": 0.15
    }
  },
  {
    "creator_id": "@reececlarke_",
    "metadata": {
      "primary_platform": "instagram",
      "follower_count": 115862,
      "main_category": "fashion"
    },
    "visual_persona_deep": {
      "beauty_archetype": {
        "pure_innocent": 0.12,
        "moody_cinematic": 0.68,
        "chic_cold": 0.45,
        "sultry_alluring": 0.32,
        "lovely_juicy": 0.05,
        "quirky_individualistic": 0.15,
        "elegant_classic": 0.88,
        "royal_noble": 0.92,
        "hip_crush": 0.25,
        "androgynous_neutral": 0.35,
        "healthy_vitality": 0.78,
        "intellectual_calm": 0.62,
        "vintage_analog": 0.48,
        "cyber_virtual_perfect": 0.42
      },
      "facial_feature_details": {
        "eye_vibe": "intense",
        "smile_type": "gentle",
        "face_shape_index": "diamond_sharp",
        "skin_texture_spec": {
          "glass_skin_level": 0.35,
          "velvet_matte_level": 0.65,
          "natural_texture_index": 0.25
        }
      },
      "color_harmony_vector": {
        "seasonal_type": "winter_cool",
        "dominant_tone": "deep",
        "contrast_preference": 0.85
      }
    },
    "brand_fit_logic": {
      "soju_affinity_matrix": {
        "chamisul_clean_index": 0.18,
        "chumchurum_soft_index": 0.15,
        "saero_zero_hip_index": 0.42,
        "jinro_retro_index": 0.28,
        "premium_single_malt_index": 0.72
      },
      "kbeauty_role_suitability": [
        "luxury_ambassador",
        "skincare_model"
      ]
    },
    "temporal_evolution_compatibility": {
      "era_1924_1950_classic": 0.45,
      "era_1960_1980_industrial": 0.22,
      "era_1990_2010_digital_y2k": 0.18,
      "era_2020_2026_future_meta": 0.58
    },
    "risk_management": {
      "brand_safety_score": 0.94,
      "competitor_overlap_index": 0.08
    }
  },
  {
    "creator_id": "@voces8",
    "metadata": {
      "primary_platform": "instagram",
      "follower_count": 134580,
      "main_category": "tech_art"
    },
    "visual_persona_deep": {
      "beauty_archetype": {
        "pure_innocent": 0.35,
        "moody_cinematic": 0.55,
        "chic_cold": 0.25,
        "sultry_alluring": 0.1,
        "lovely_juicy": 0.05,
        "quirky_individualistic": 0.15,
        "elegant_classic": 0.82,
        "royal_noble": 0.78,
        "hip_crush": 0.1,
        "androgynous_neutral": 0.3,
        "healthy_vitality": 0.4,
        "intellectual_calm": 0.85,
        "vintage_analog": 0.6,
        "cyber_virtual_perfect": 0.1
      },
      "facial_feature_details": {
        "eye_vibe": "dreamy",
        "smile_type": "gentle",
        "face_shape_index": "oval_smooth",
        "skin_texture_spec": {
          "glass_skin_level": 0.3,
          "velvet_matte_level": 0.6,
          "natural_texture_index": 0.4
        }
      },
      "color_harmony_vector": {
        "seasonal_type": "summer_cool",
        "dominant_tone": "deep",
        "contrast_preference": 0.75
      }
    },
    "brand_fit_logic": {
      "soju_affinity_matrix": {
        "chamisul_clean_index": 0.25,
        "chumchurum_soft_index": 0.15,
        "saero_zero_hip_index": 0.2,
        "jinro_retro_index": 0.35,
        "premium_single_malt_index": 0.65
      },
      "kbeauty_role_suitability": [
        "luxury_ambassador",
        "clean_beauty_advocate"
      ]
    },
    "temporal_evolution_compatibility": {
      "era_1924_1950_classic": 0.75,
      "era_1960_1980_industrial": 0.3,
      "era_1990_2010_digital_y2k": 0.1,
      "era_2020_2026_future_meta": 0.25
    },
    "risk_management": {
      "brand_safety_score": 0.98,
      "competitor_overlap_index": 0.05
    }
  },
  {
    "creator_id": "@rhiathesaint",
    "metadata": {
      "primary_platform": "instagram",
      "follower_count": 156183,
      "main_category": "beauty"
    },
    "visual_persona_deep": {
      "beauty_archetype": {
        "pure_innocent": 0.05,
        "moody_cinematic": 0.42,
        "chic_cold": 0.55,
        "sultry_alluring": 0.62,
        "lovely_juicy": 0.15,
        "quirky_individualistic": 0.78,
        "elegant_classic": 0.35,
        "royal_noble": 0.48,
        "hip_crush": 0.65,
        "androgynous_neutral": 0.12,
        "healthy_vitality": 0.28,
        "intellectual_calm": 0.18,
        "vintage_analog": 0.22,
        "cyber_virtual_perfect": 0.58
      },
      "facial_feature_details": {
        "eye_vibe": "intense",
        "smile_type": "smirk",
        "face_shape_index": "oval_smooth",
        "skin_texture_spec": {
          "glass_skin_level": 0.85,
          "velvet_matte_level": 0.75,
          "natural_texture_index": 0.25
        }
      },
      "color_harmony_vector": {
        "seasonal_type": "winter_cool",
        "dominant_tone": "deep",
        "contrast_preference": 0.95
      }
    },
    "brand_fit_logic": {
      "soju_affinity_matrix": {
        "chamisul_clean_index": 0.08,
        "chumchurum_soft_index": 0.12,
        "saero_zero_hip_index": 0.45,
        "jinro_retro_index": 0.15,
        "premium_single_malt_index": 0.52
      },
      "kbeauty_role_suitability": [
        "color_makeup_expert",
        "luxury_ambassador"
      ]
    },
    "temporal_evolution_compatibility": {
      "era_1924_1950_classic": 0.05,
      "era_1960_1980_industrial": 0.18,
      "era_1990_2010_digital_y2k": 0.65,
      "era_2020_2026_future_meta": 0.72
    },
    "risk_management": {
      "brand_safety_score": 0.82,
      "competitor_overlap_index": 0.25
    }
  },
  {
    "creator_id": "@kenyas_finest",
    "metadata": {
      "primary_platform": "instagram",
      "follower_count": 121544,
      "main_category": "lifestyle"
    },
    "visual_persona_deep": {
      "beauty_archetype": {
        "pure_innocent": 0.08,
        "moody_cinematic": 0.42,
        "chic_cold": 0.45,
        "sultry_alluring": 0.62,
        "lovely_juicy": 0.15,
        "quirky_individualistic": 0.22,
        "elegant_classic": 0.58,
        "royal_noble": 0.65,
        "hip_crush": 0.48,
        "androgynous_neutral": 0.12,
        "healthy_vitality": 0.35,
        "intellectual_calm": 0.25,
        "vintage_analog": 0.18,
        "cyber_virtual_perfect": 0.38
      },
      "facial_feature_details": {
        "eye_vibe": "intense",
        "smile_type": "gentle",
        "face_shape_index": "oval_smooth",
        "skin_texture_spec": {
          "glass_skin_level": 0.72,
          "velvet_matte_level": 0.68,
          "natural_texture_index": 0.25
        }
      },
      "color_harmony_vector": {
        "seasonal_type": "autumn_warm",
        "dominant_tone": "deep",
        "contrast_preference": 0.75
      }
    },
    "brand_fit_logic": {
      "soju_affinity_matrix": {
        "chamisul_clean_index": 0.12,
        "chumchurum_soft_index": 0.28,
        "saero_zero_hip_index": 0.45,
        "jinro_retro_index": 0.15,
        "premium_single_malt_index": 0.62
      },
      "kbeauty_role_suitability": [
        "luxury_ambassador",
        "color_makeup_expert"
      ]
    },
    "temporal_evolution_compatibility": {
      "era_1924_1950_classic": 0.05,
      "era_1960_1980_industrial": 0.12,
      "era_1990_2010_digital_y2k": 0.35,
      "era_2020_2026_future_meta": 0.68
    },
    "risk_management": {
      "brand_safety_score": 0.88,
      "competitor_overlap_index": 0.15
    }
  },
  {
    "creator_id": "@dejonnoelwilliams",
    "metadata": {
      "primary_platform": "instagram",
      "follower_count": 308605,
      "main_category": "lifestyle"
    },
    "visual_persona_deep": {
      "beauty_archetype": {
        "pure_innocent": 0.05,
        "moody_cinematic": 0.32,
        "chic_cold": 0.15,
        "sultry_alluring": 0.28,
        "lovely_juicy": 0.08,
        "quirky_individualistic": 0.12,
        "elegant_classic": 0.25,
        "royal_noble": 0.35,
        "hip_crush": 0.48,
        "androgynous_neutral": 0.05,
        "healthy_vitality": 0.78,
        "intellectual_calm": 0.31,
        "vintage_analog": 0.14,
        "cyber_virtual_perfect": 0.22
      },
      "facial_feature_details": {
        "eye_vibe": "intense",
        "smile_type": "full_sunshine",